{
  "schemaVersion": 1,
  "acquisitionId": "20260531__usgs-nas-dwca-v1-344__563b13cbf2f8",
  "acquisitionReceiptPath": "src/data/research/national-acquisitions/20260531__usgs-nas-dwca-v1-344__563b13cbf2f8/receipt.json",
  "acquisitionReceiptSha256": "7d3a14c612282d77d8931d5a3b145aa1bcb70831cc7f28d4e57b22142a49ebb9",
  "archiveVersion": "1.344",
  "archivePath": "src/data/research/national-acquisitions/20260531__usgs-nas-dwca-v1-344__563b13cbf2f8/artifacts/usgs-nas-dwca-v1.344.zip",
  "archiveSha256": "563b13cbf2f83337c9528898ecb0a7de0719e3b68518147d638e60bc8c585f28",
  "archiveBytes": 31174629,
  "planPath": "src/data/research/national-acquisition-plans/usgs-nas-national-v1-wave-03.json",
  "planSha256": "66fe9e61af4de24532ce65f1a7a295a629bedeac589ed9f9703576c2ce10b292",
  "sourceId": "usgs-nas",
  "adapterVersion": "1.0.0",
  "adapterCodeSha256": "cfcbf64d560adb2d61140eba1f282136c6a4b9f4ff5dd6e0fe61403bac6c32f0",
  "partitionScriptSha256": "cd4cb34584027e56a43f1cd811347a18cbbb8cba30faf32646e6f6bdadfb3799",
  "stateCode": "MT",
  "speciesId": "lythrum-salicaria",
  "scientificName": "Lythrum salicaria",
  "partitionMode": "exact-state-county-name-and-status-no-coordinate-fallback",
  "selectedRowsSha256": "a656624a9c1c2fea06b61c035deed7b4c18347845936eaf6e9899e66ac5d5c73",
  "reconciliation": {
    "selected_records": 8,
    "accepted_records": 8,
    "rejected_candidate_records": 0,
    "assertion_pairs": 8,
    "rejection_events": 0,
    "duplicate_record_ids": 0,
    "blank_status_records": 0,
    "unsupported_status_records": 0,
    "missing_geography_records": 0,
    "retired_geography_records": 0,
    "unknown_or_ambiguous_geography_records": 0,
    "invalid_identity_records": 0,
    "blocking_candidate_records": 0,
    "blocked_outcome_pairs": 0
  }
}
