{
  "schemaVersion": 1,
  "acquisitionId": "20260531__usgs-nas-dwca-v1-344__563b13cbf2f8",
  "acquisitionReceiptPath": "src/data/research/national-acquisitions/20260531__usgs-nas-dwca-v1-344__563b13cbf2f8/receipt.json",
  "acquisitionReceiptSha256": "7d3a14c612282d77d8931d5a3b145aa1bcb70831cc7f28d4e57b22142a49ebb9",
  "archiveVersion": "1.344",
  "archivePath": "src/data/research/national-acquisitions/20260531__usgs-nas-dwca-v1-344__563b13cbf2f8/artifacts/usgs-nas-dwca-v1.344.zip",
  "archiveSha256": "563b13cbf2f83337c9528898ecb0a7de0719e3b68518147d638e60bc8c585f28",
  "archiveBytes": 31174629,
  "planPath": "src/data/research/national-acquisition-plans/usgs-nas-national-v1-wave-02.json",
  "planSha256": "a68a5d7d1b339b13078db0bc4b97a031b1d54d80fed692a523af145107d4f1ab",
  "sourceId": "usgs-nas",
  "adapterVersion": "1.0.0",
  "adapterCodeSha256": "cfcbf64d560adb2d61140eba1f282136c6a4b9f4ff5dd6e0fe61403bac6c32f0",
  "partitionScriptSha256": "cd4cb34584027e56a43f1cd811347a18cbbb8cba30faf32646e6f6bdadfb3799",
  "stateCode": "MA",
  "speciesId": "myriophyllum-spicatum",
  "scientificName": "Myriophyllum spicatum",
  "partitionMode": "exact-state-county-name-and-status-no-coordinate-fallback",
  "selectedRowsSha256": "bba59698d43baaf88844c8c0238da72209efa357cc2abcadda22e7bf5440eb26",
  "reconciliation": {
    "selected_records": 173,
    "accepted_records": 167,
    "rejected_candidate_records": 6,
    "assertion_pairs": 10,
    "rejection_events": 4,
    "duplicate_record_ids": 0,
    "blank_status_records": 0,
    "unsupported_status_records": 6,
    "missing_geography_records": 0,
    "retired_geography_records": 0,
    "unknown_or_ambiguous_geography_records": 0,
    "invalid_identity_records": 0,
    "blocking_candidate_records": 0,
    "blocked_outcome_pairs": 0
  }
}
