{
  "schemaVersion": 1,
  "acquisitionId": "20260531__usgs-nas-dwca-v1-344__563b13cbf2f8",
  "acquisitionReceiptPath": "src/data/research/national-acquisitions/20260531__usgs-nas-dwca-v1-344__563b13cbf2f8/receipt.json",
  "acquisitionReceiptSha256": "7d3a14c612282d77d8931d5a3b145aa1bcb70831cc7f28d4e57b22142a49ebb9",
  "archiveVersion": "1.344",
  "archivePath": "src/data/research/national-acquisitions/20260531__usgs-nas-dwca-v1-344__563b13cbf2f8/artifacts/usgs-nas-dwca-v1.344.zip",
  "archiveSha256": "563b13cbf2f83337c9528898ecb0a7de0719e3b68518147d638e60bc8c585f28",
  "archiveBytes": 31174629,
  "planPath": "src/data/research/national-acquisition-plans/usgs-nas-national-v1-wave-01.json",
  "planSha256": "3bc6f290605138b6c6c7a09b21da8f18aa92dc7c5d1be02999d744897a12cc85",
  "sourceId": "usgs-nas",
  "adapterVersion": "1.0.0",
  "adapterCodeSha256": "bd8c49c4e3f33a77dea625cff386be068572f936cdee531429f9967dd350af41",
  "partitionScriptSha256": "cd4cb34584027e56a43f1cd811347a18cbbb8cba30faf32646e6f6bdadfb3799",
  "stateCode": "HI",
  "speciesId": "eichhornia-crassipes",
  "scientificName": "Eichhornia crassipes",
  "partitionMode": "exact-state-county-name-and-status-no-coordinate-fallback",
  "selectedRowsSha256": "90148238adc95492ca25969b848e3449041272298bd227b4e64758cfd6466416",
  "reconciliation": {
    "selected_records": 5,
    "accepted_records": 5,
    "rejected_candidate_records": 0,
    "assertion_pairs": 4,
    "rejection_events": 0,
    "duplicate_record_ids": 0,
    "blank_status_records": 0,
    "unsupported_status_records": 0,
    "missing_geography_records": 0,
    "retired_geography_records": 0,
    "unknown_or_ambiguous_geography_records": 0,
    "invalid_identity_records": 0,
    "blocking_candidate_records": 0,
    "blocked_outcome_pairs": 0
  }
}
